{
  "schema_version": "v0",
  "run": {
    "run_id": "run_retry_2",
    "started_at": "2026-04-20T02:02:00.000Z",
    "ended_at": "2026-04-20T02:02:02.100Z",
    "duration_ms": 2100,
    "status": "ok"
  },
  "spans": [
    {
      "span_id": "spn_retry_2_root",
      "run_id": "run_retry_2",
      "parent_span_id": null,
      "retry_of_span_id": null,
      "kind": "orchestration",
      "name": "agent.execute",
      "started_at": "2026-04-20T02:02:00.000Z",
      "ended_at": "2026-04-20T02:02:02.100Z",
      "duration_ms": 2100,
      "status": "ok"
    },
    {
      "span_id": "spn_retry_2_model",
      "run_id": "run_retry_2",
      "parent_span_id": "spn_retry_2_root",
      "retry_of_span_id": null,
      "kind": "model",
      "name": "model.plan",
      "started_at": "2026-04-20T02:02:00.100Z",
      "ended_at": "2026-04-20T02:02:00.450Z",
      "duration_ms": 350,
      "status": "ok"
    },
    {
      "span_id": "spn_retry_2_tool",
      "run_id": "run_retry_2",
      "parent_span_id": "spn_retry_2_root",
      "retry_of_span_id": null,
      "kind": "tool",
      "name": "tool.fetch",
      "started_at": "2026-04-20T02:02:00.500Z",
      "ended_at": "2026-04-20T02:02:01.100Z",
      "duration_ms": 600,
      "status": "ok"
    },
    {
      "span_id": "spn_retry_2_retry",
      "run_id": "run_retry_2",
      "parent_span_id": "spn_retry_2_root",
      "retry_of_span_id": "spn_retry_2_tool",
      "kind": "retry",
      "name": "retry.tool.fetch",
      "started_at": "2026-04-20T02:02:01.200Z",
      "ended_at": "2026-04-20T02:02:01.800Z",
      "duration_ms": 600,
      "status": "ok"
    }
  ],
  "events": [
    {
      "event_id": "evt_retry_2_start",
      "run_id": "run_retry_2",
      "span_id": "spn_retry_2_root",
      "kind": "orchestration",
      "ts": "2026-04-20T02:02:00.000Z",
      "payload": {
        "phase": "start"
      }
    },
    {
      "event_id": "evt_retry_2_model",
      "run_id": "run_retry_2",
      "span_id": "spn_retry_2_model",
      "kind": "model",
      "ts": "2026-04-20T02:02:00.200Z",
      "payload": {
        "provider": "openai",
        "model": "gpt-4.1-mini"
      }
    },
    {
      "event_id": "evt_retry_2_tool",
      "run_id": "run_retry_2",
      "span_id": "spn_retry_2_tool",
      "kind": "tool",
      "ts": "2026-04-20T02:02:00.700Z",
      "payload": {
        "tool": "fetch",
        "endpoint": "inventory"
      }
    },
    {
      "event_id": "evt_retry_2_retry",
      "run_id": "run_retry_2",
      "span_id": "spn_retry_2_retry",
      "kind": "retry",
      "ts": "2026-04-20T02:02:01.300Z",
      "payload": {
        "reason": "timeout"
      }
    }
  ],
  "errors": [],
  "usage": [
    {
      "usage_id": "use_retry_2_model",
      "run_id": "run_retry_2",
      "span_id": "spn_retry_2_model",
      "kind": "model",
      "prompt_tokens": 120,
      "completion_tokens": 80,
      "total_tokens": 200,
      "estimated_cost_usd": 0.0024,
      "currency": "USD"
    },
    {
      "usage_id": "use_retry_2_tool",
      "run_id": "run_retry_2",
      "span_id": "spn_retry_2_tool",
      "kind": "tool",
      "prompt_tokens": 0,
      "completion_tokens": 0,
      "total_tokens": 0,
      "estimated_cost_usd": 0.0004,
      "currency": "USD"
    }
  ]
}
